"country","England without London","London","Scotland","Wales","Great Britain"
"Most recent year available","(2019-20)","(2019-20)","(2019-20)","(2019-20)","(2019-20)"
"Average annual change in income","294.482214",NA,"  4.525777","  4.673735"," 99.313313"
"Change in income since previous year","16.314791","15.300135"," 4.827493"," 2.547899","14.932396"
"Average annual change in expenditure","276.117493",NA,"  2.421295",NA," 91.172204"
"Change in expenditure since previous year","19.859144","15.407859"," 4.710155","-4.244775","18.034134"
"Average annual change in surplus","325.189092",NA,"  6.579357"," 43.391073","107.959089"
"Change in surplus since previous year","12.2225795","15.2320986"," 4.9313674"," 0.6645888","12.3909338"
