"country","England without London","London","Scotland","Wales","Great Britain"
"Most recent year available","(2021-22)","(2020-21)","(2021-22)","(2021-22)","(2020-21)"
"Average annual change in income","17.746281","-1.965378","-2.866786","-1.022698","-7.752844"
"Change in income since previous year","228.67090","-18.78317"," 83.72093","116.93148","-36.74429"
"Average annual change in expenditure","17.069081"," 2.379663"," 2.078171",NA," 2.176509"
"Change in expenditure since previous year","  71.788371","   1.651484","   6.098462","-191.240772","  -1.497039"
"Average annual change in surplus"," 18.454753"," -5.330555"," -8.576284"," 33.172744","-21.052513"
"Change in surplus since previous year"," 4446.61319","  -31.70908","-1717.40260","  480.79715","  -67.07482"
